{
  "schema_version": "policy_translation_review.v1",
  "proposal_id": "policy-translation-proposal-03131ebb6c264b8e21e6cfc250229acec6872632879d1b26193d069f1951b3be",
  "proposal_hash": "sha256:03131ebb6c264b8e21e6cfc250229acec6872632879d1b26193d069f1951b3be",
  "source_policy_ref": "repository-policy@revision-1",
  "source_snapshot_hash": "sha256:ff5601216d1505cc8d8c9fb73fe3276d3a7852a083f302e8767e592ca1b3727f",
  "authority_ref": "repository-create-only@2.0.0",
  "capability_catalog": {
    "catalog_id": "waveframe.coding-agent.repository-change",
    "catalog_version": "2.0.0",
    "catalog_hash": "sha256:8530e82761a333c5e7e8cc0ccb0b2949310ea91b470d548613c98078896f030a"
  },
  "coverage": {
    "total_clause_count": 3,
    "enforced_clause_count": 3,
    "unenforced_clause_count": 0,
    "unresolved_clause_count": 0,
    "fully_represented_clause_count": 3,
    "partially_represented_clause_count": 0,
    "entirely_unsupported_clause_count": 0,
    "informational_clause_count": 0,
    "unrepresented_clause_count": 0,
    "enforced_clause_ids": [
      "policy-clause-2532c0e8dca3a40a13b50b15eb50173c9deb85dae6b33a476b437fa66e5f122e",
      "policy-clause-e9f35596a2e42d45817b4d363668a20e268c145e5e87b758444b6d3a1f2e8743",
      "policy-clause-f7d301eec705aaa85360a4ddcc91d197d96136302e75c1731ed6d8656b683e22"
    ],
    "unenforced_clause_ids": [],
    "acknowledged_unrepresented_clause_ids": [],
    "total_control_count": 3,
    "confirmed_control_count": 3,
    "unresolved_control_count": 0,
    "confirmed_control_ids": [
      "candidate-control-032425c1ae5101f30389f31f2cbf00f74d4717dc553a43668cd756bdf58ebe5d",
      "candidate-control-64b8eedf5747098ba739c3083f900db9b639f81d9f35d9082ae7426ddf0fd9ef",
      "candidate-control-dfe5ff45ba28b31f7f598cd655c2cb4e4e329f9405aa8b9b22b82defea95154d"
    ],
    "unresolved_control_ids": []
  },
  "clauses": [
    {
      "clause_id": "policy-clause-f7d301eec705aaa85360a4ddcc91d197d96136302e75c1731ed6d8656b683e22",
      "source_text": "Agents must use role repository-maintainer to create repository files.\n",
      "proposed_coverage_status": "fully_represented",
      "human_coverage_status": "fully_represented",
      "controls": [
        {
          "candidate_control_id": "candidate-control-032425c1ae5101f30389f31f2cbf00f74d4717dc553a43668cd756bdf58ebe5d",
          "human_confirmed": true,
          "operational_explanation": "The create action requires repository role 'repository-maintainer'. This role grants no operation. Development validation only; compatible Guard and hosted Cloud activation are pending. An absent action or missing matching allow grants no permission. A matching deny wins within the same action; rules never cross actions. Roles restrict an action and grant no paths. Creation requires one new regular file under an existing parent in the selected workspace, without overwrite or parent creation. Guard must check filesystem state, not caller facts.",
          "remaining_unresolved_bindings": [],
          "questions": [],
          "technical_details": {
            "control_type": "acting_role",
            "fact_id": "actor.role",
            "operator": "==",
            "effect": "require",
            "enforcement_point": "waveframe.guard.repository-change.v2-development"
          }
        }
      ],
      "residual_explanation": null
    },
    {
      "clause_id": "policy-clause-2532c0e8dca3a40a13b50b15eb50173c9deb85dae6b33a476b437fa66e5f122e",
      "source_text": "Agents may create files under generated/.\n",
      "proposed_coverage_status": "fully_represented",
      "human_coverage_status": "fully_represented",
      "controls": [
        {
          "candidate_control_id": "candidate-control-64b8eedf5747098ba739c3083f900db9b639f81d9f35d9082ae7426ddf0fd9ef",
          "human_confirmed": true,
          "operational_explanation": "Automated agents may create files under 'generated/'. Development validation only; compatible Guard and hosted Cloud activation are pending. An absent action or missing matching allow grants no permission. A matching deny wins within the same action; rules never cross actions. Roles restrict an action and grant no paths. Creation requires one new regular file under an existing parent in the selected workspace, without overwrite or parent creation. Guard must check filesystem state, not caller facts.",
          "remaining_unresolved_bindings": [],
          "questions": [],
          "technical_details": {
            "control_type": "prefix_path_access",
            "fact_id": "proposal.resource.path",
            "operator": "starts_with",
            "effect": "allow",
            "enforcement_point": "waveframe.guard.repository-change.v2-development"
          }
        }
      ],
      "residual_explanation": null
    },
    {
      "clause_id": "policy-clause-e9f35596a2e42d45817b4d363668a20e268c145e5e87b758444b6d3a1f2e8743",
      "source_text": "Agents must not create files under generated/private/.",
      "proposed_coverage_status": "fully_represented",
      "human_coverage_status": "fully_represented",
      "controls": [
        {
          "candidate_control_id": "candidate-control-dfe5ff45ba28b31f7f598cd655c2cb4e4e329f9405aa8b9b22b82defea95154d",
          "human_confirmed": true,
          "operational_explanation": "Automated agents must not create files under 'generated/private/'. This restriction grants no operation. Development validation only; compatible Guard and hosted Cloud activation are pending. An absent action or missing matching allow grants no permission. A matching deny wins within the same action; rules never cross actions. Roles restrict an action and grant no paths. Creation requires one new regular file under an existing parent in the selected workspace, without overwrite or parent creation. Guard must check filesystem state, not caller facts.",
          "remaining_unresolved_bindings": [],
          "questions": [],
          "technical_details": {
            "control_type": "prefix_path_access",
            "fact_id": "proposal.resource.path",
            "operator": "starts_with",
            "effect": "deny",
            "enforcement_point": "waveframe.guard.repository-change.v2-development"
          }
        }
      ],
      "residual_explanation": null
    }
  ],
  "provider_explanations_used": false,
  "review_hash": "sha256:9d1cfec0b642b3ddee6eb2ed2976a987e9a68099e8ffcb8676e296e95cb24be2"
}
